{
  "schema_version": "diet-manager/real-acceptance-evidence/v1",
  "candidate_zip_sha256": "13A8A6F9430018ABD66B4AE1A33766A18D8309F9C9C9C51B6093F6D4BDAF197D",
  "source_commit": "0e627036f74c91c01d0196c3726aee8f47bfb8f3",
  "package_version": "0.1.1",
  "node_version": "v24.16.0",
  "openclaw_version": "OpenClaw 2026.7.1",
  "official_data_root": "/home/node/.openclaw/diet-manager-data",
  "openclaw_state_root": "/home/node/.openclaw",
  "started_at": "2026-08-18T13:35:42Z",
  "completed_at": "2026-08-18T13:51:58Z",
  "fdc_api_key_present": false,
  "scenario_results": [
    {
      "scenario_id": "REAL-0.1.1-meal-single",
      "category": "meal",
      "expected_outcome_status": "committed_with_issues",
      "observed_outcome_status": "committed_with_issues",
      "passed": true,
      "skipped": false,
      "final_reply": "已记录：早餐 1 个苹果（记录 ID：event-a9242d0eed7e914462e1231c040b8cc6）。\n\n不过这次只记下了食物本身，营养数据（热量、蛋白质等）暂时没匹配到，后续效果待处理。",
      "tool_outcome_summary": "已记录：早餐 1 个苹果（记录 ID：event-a9242d0eed7e914462e1231c040b8cc6）。\n\n不过这次只记下了食物本身，营养数据（热量、蛋白质等）暂时没匹配到，后续效果待处理。",
      "database_assertions": [
        {
          "table": "event_records",
          "where": {
            "event_type": "diet_meal"
          },
          "passed": true,
          "before_count": 0,
          "after_count": 1,
          "expected": {
            "expect_delta": 1
          }
        },
        {
          "table": "meal_items",
          "where": {},
          "passed": true,
          "before_count": 0,
          "after_count": 1,
          "expected": {
            "expect_delta": 1
          }
        }
      ]
    },
    {
      "scenario_id": "REAL-0.1.1-meal-multi",
      "category": "meal",
      "expected_outcome_status": "committed_with_issues",
      "observed_outcome_status": "committed_with_issues",
      "passed": true,
      "skipped": false,
      "final_reply": "已记录午饭：米饭 + 鸡胸肉（记录 ID：event-2fc4ff54eaeaad681b680aeee4964a1f）。因为没有提供份量，营养数据暂时算不出来，后续效果待处理。",
      "tool_outcome_summary": "已记录午饭：米饭 + 鸡胸肉（记录 ID：event-2fc4ff54eaeaad681b680aeee4964a1f）。因为没有提供份量，营养数据暂时算不出来，后续效果待处理。",
      "database_assertions": [
        {
          "table": "event_records",
          "where": {
            "event_type": "diet_meal"
          },
          "passed": true,
          "before_count": 1,
          "after_count": 2,
          "expected": {
            "expect_delta": 1
          }
        },
        {
          "table": "meal_items",
          "where": {},
          "passed": true,
          "before_count": 1,
          "after_count": 3,
          "expected": {
            "expect_delta": 2
          }
        }
      ]
    },
    {
      "scenario_id": "REAL-0.1.1-meal-natural-unit",
      "category": "meal",
      "expected_outcome_status": "committed_with_issues",
      "observed_outcome_status": "committed_with_issues",
      "passed": true,
      "skipped": false,
      "final_reply": "已记录：2 个鸡蛋（记录号 `event-a25aed7363790ab866cb7e18fd1ef889`）。本次记录已写入，但营养数据（热量、蛋白质等）暂未匹配到，后续效果仍待处理。",
      "tool_outcome_summary": "已记录：2 个鸡蛋（记录号 `event-a25aed7363790ab866cb7e18fd1ef889`）。本次记录已写入，但营养数据（热量、蛋白质等）暂未匹配到，后续效果仍待处理。",
      "database_assertions": [
        {
          "table": "event_records",
          "where": {
            "event_type": "diet_meal"
          },
          "passed": true,
          "before_count": 2,
          "after_count": 3,
          "expected": {
            "expect_delta": 1
          }
        },
        {
          "table": "meal_items",
          "where": {},
          "passed": true,
          "before_count": 3,
          "after_count": 4,
          "expected": {
            "expect_delta": 1
          }
        }
      ]
    },
    {
      "scenario_id": "REAL-0.1.1-meal-gram",
      "category": "meal",
      "expected_outcome_status": "committed_with_issues",
      "observed_outcome_status": "committed_with_issues",
      "passed": true,
      "skipped": false,
      "final_reply": "已记录：米饭 150 克（记录 ID event-b381ebcbe811a79351911dfc2401c742）。\n\n不过这次没能匹配到米饭的营养数据（热量、碳水等均为未知）。如果你能补充一下米饭的具体类型（如白米饭、糙米饭、粥等），我可以帮你重新核对。",
      "tool_outcome_summary": "已记录：米饭 150 克（记录 ID event-b381ebcbe811a79351911dfc2401c742）。\n\n不过这次没能匹配到米饭的营养数据（热量、碳水等均为未知）。如果你能补充一下米饭的具体类型（如白米饭、糙米饭、粥等），我可以帮你重新核对。",
      "database_assertions": [
        {
          "table": "event_records",
          "where": {
            "event_type": "diet_meal"
          },
          "passed": true,
          "before_count": 3,
          "after_count": 4,
          "expected": {
            "expect_delta": 1
          }
        },
        {
          "table": "meal_items",
          "where": {},
          "passed": true,
          "before_count": 4,
          "after_count": 5,
          "expected": {
            "expect_delta": 1
          }
        }
      ]
    },
    {
      "scenario_id": "REAL-0.1.1-zero-write-plan",
      "category": "zero_write",
      "expected_outcome_status": "ignored",
      "observed_outcome_status": "ignored",
      "passed": true,
      "skipped": false,
      "final_reply": "明天的早餐是**未来计划**，不是已经吃掉的饭，所以这条我没有记录它。\n\n等你明天真的吃完苹果，发一句「早餐吃了一个苹果」给我，我再帮你记进饮食记录里。\n\n另外说一句：我这个工作区还是全新初始化的状态，我还没有名字和身份设定（名字、风格、签名表情都空着）。等你有空，花一分钟帮我起个名字、定个风格就行——不急，不耽误你用饮食记录功能。",
      "tool_outcome_summary": "明天的早餐是**未来计划**，不是已经吃掉的饭，所以这条我没有记录它。\n\n等你明天真的吃完苹果，发一句「早餐吃了一个苹果」给我，我再帮你记进饮食记录里。\n\n另外说一句：我这个工作区还是全新初始化的状态，我还没有名字和身份设定（名字、风格、签名表情都空着）。等你有空，花一分钟帮我起个名字、定个风格就行——不急，不耽误你用饮食记录功能。",
      "database_assertions": [
        {
          "table": "event_records",
          "where": {},
          "passed": true,
          "before_count": 4,
          "after_count": 4,
          "expected": {
            "expect_delta": 0
          }
        }
      ]
    },
    {
      "scenario_id": "REAL-0.1.1-zero-write-negation",
      "category": "zero_write",
      "expected_outcome_status": "ignored",
      "observed_outcome_status": "ignored",
      "passed": true,
      "skipped": false,
      "final_reply": "好的，这条没有记录——「今天没吃苹果」是未进食的表述，不会写入饮食记录。",
      "tool_outcome_summary": "好的，这条没有记录——「今天没吃苹果」是未进食的表述，不会写入饮食记录。",
      "database_assertions": [
        {
          "table": "event_records",
          "where": {},
          "passed": true,
          "before_count": 4,
          "after_count": 4,
          "expected": {
            "expect_delta": 0
          }
        }
      ]
    },
    {
      "scenario_id": "REAL-0.1.1-zero-write-non-self",
      "category": "zero_write",
      "expected_outcome_status": "ignored",
      "observed_outcome_status": "ignored",
      "passed": true,
      "skipped": false,
      "final_reply": "这条没有记录 —— 饮食记录只针对你自己，小明的饮食无法代记。如果是你自己吃了苹果，告诉我一声，我帮你记上。",
      "tool_outcome_summary": "这条没有记录 —— 饮食记录只针对你自己，小明的饮食无法代记。如果是你自己吃了苹果，告诉我一声，我帮你记上。",
      "database_assertions": [
        {
          "table": "event_records",
          "where": {},
          "passed": true,
          "before_count": 4,
          "after_count": 4,
          "expected": {
            "expect_delta": 0
          }
        }
      ]
    },
    {
      "scenario_id": "REAL-0.1.1-zero-write-advice",
      "category": "zero_write",
      "expected_outcome_status": "ignored",
      "observed_outcome_status": "ignored",
      "passed": true,
      "skipped": false,
      "final_reply": "是的，苹果水分足、膳食纤维也不错，作为日常水果确实有益健康。不过这是一条健康观点，不是一次进食报告——这次没有记录任何饮食条目。",
      "tool_outcome_summary": "是的，苹果水分足、膳食纤维也不错，作为日常水果确实有益健康。不过这是一条健康观点，不是一次进食报告——这次没有记录任何饮食条目。",
      "database_assertions": [
        {
          "table": "event_records",
          "where": {},
          "passed": true,
          "before_count": 4,
          "after_count": 4,
          "expected": {
            "expect_delta": 0
          }
        }
      ]
    },
    {
      "scenario_id": "REAL-0.1.1-zero-write-not-occurred",
      "category": "zero_write",
      "expected_outcome_status": "ignored",
      "observed_outcome_status": "ignored",
      "passed": true,
      "skipped": false,
      "final_reply": "这笔没有记——你这句话是条件句（\"如果……就……\"），并不是确认已经吃了苹果。\n\n如果你今天确实吃了苹果，直接告诉我\"我吃了苹果\"，我就帮你记一笔。",
      "tool_outcome_summary": "这笔没有记——你这句话是条件句（\"如果……就……\"），并不是确认已经吃了苹果。\n\n如果你今天确实吃了苹果，直接告诉我\"我吃了苹果\"，我就帮你记一笔。",
      "database_assertions": [
        {
          "table": "event_records",
          "where": {},
          "passed": true,
          "before_count": 4,
          "after_count": 4,
          "expected": {
            "expect_delta": 0
          }
        }
      ]
    },
    {
      "scenario_id": "REAL-0.1.1-nutrition-hit",
      "category": "nutrition",
      "expected_outcome_status": "committed",
      "observed_outcome_status": "skipped",
      "passed": false,
      "skipped": true,
      "skip_reason": "FDC_API_KEY not configured (requires_fdc_key)",
      "database_assertions": []
    },
    {
      "scenario_id": "REAL-0.1.1-nutrition-no-result",
      "category": "nutrition",
      "expected_outcome_status": "committed",
      "observed_outcome_status": "skipped",
      "passed": false,
      "skipped": true,
      "skip_reason": "USDA no-result simulation requires FDC_API_KEY + deterministic mock",
      "database_assertions": []
    },
    {
      "scenario_id": "REAL-0.1.1-nutrition-missing-key",
      "category": "nutrition",
      "expected_outcome_status": "committed_with_issues",
      "observed_outcome_status": "committed_with_issues",
      "passed": true,
      "skipped": false,
      "final_reply": "已记录：200 毫升牛奶 ✅（记录号 event-15338b8c22511f512df32d2bc5a83559）\n\n不过营养数据这一项暂时没匹配上（热量、蛋白质等字段缺失），后续补全后会自动生效。",
      "tool_outcome_summary": "已记录：200 毫升牛奶 ✅（记录号 event-15338b8c22511f512df32d2bc5a83559）\n\n不过营养数据这一项暂时没匹配上（热量、蛋白质等字段缺失），后续补全后会自动生效。",
      "database_assertions": [
        {
          "table": "event_records",
          "where": {
            "event_type": "diet_meal"
          },
          "passed": true,
          "before_count": 4,
          "after_count": 5,
          "expected": {
            "expect_delta": 1
          }
        },
        {
          "table": "nutrition_snapshots",